capabaseargenmap;SINGLE;Capa base Argenmap;argenmap;3857;Composición de capas bases (IGN);ne_10m_bathymetry_l_0,ne_10m_bathymetry_k_200,ne_10m_bathymetry_j_1000,ne_10m_bathymetry_i_2000,ne_10m_bathymetry_h_3000,ne_10m_bathymetry_g_4000,ne_10m_bathymetry_f_5000,ne_10m_bathymetry_e_6000,ne_10m_bathymetry_d_7000,ne_10m_bathymetry_c_8000,ne_10m_bathymetry_b_9000,ne_10m_bathymetry_a_10000,pais,areas_de_asentamientos_y_edificios,osm_plazas,areas_de_aguas_continentales,areas_de_zona_costera,lineas_de_aguas_continentales,area_protegida,areas_de_aguas_continentales,areas_de_glaciologia,lineas_de_glaciologia,vial,red_vial_nacional_dnv,osm_vial,lineas_de_transporte_ferroviario,lineas_de_geomorfologia,puntos_de_geomorfologia,toponimos_oceano,toponimia_maritima,linea_de_limite,puntos_de_asentamientos_y_edificios,departamento,etiquetas_provincias,etiquetas_paises;batimetria_0_capa_base,batimetria_200_capa_base,batimetria_1000_capa_base,batimetria_2000_capa_base,batimetria_3000_capa_base,batimetria_4000_capa_base,batimetria_5000_capa_base,batimetria_6000_capa_base,batimetria_7000_capa_base,batimetria_8000_capa_base,batimetria_9000_capa_base,batimetria_10000_capa_base,paises_geometria,area_asentamiento_capa_base,plaza_osm_capa_base,areas_aguas_continentales_capa_base,isla_capa_base,lineas_aguas_continentales_capa_base,area_protegida_capa_base,embalse_espejo_agua_capa_base,areas_glaciologia_capa_base,lineas_glaciologia_capa_base,vial_capa_base,vial_dnv_capa_base,osm_vial_capa_base,linea_transporte_ferroviario_capa_base,linea_geomorfologia_capa_base,cerro_capa_base,toponimos_oceanos_capa_base,toponimia_maritima_capa_base,linea_limite_capa_base,puntos_localidades_capa_base,departamentos_etiquetas_capa_base,provincias_etiquetas_capa_base,etiquetas_paises;
helipuerto;SINGLE;Helipuerto;transporte;4326;Pista circular marcada con una letra ¨H¨, para la operación de aeronaves de despegue vertical. Puede incluir instalaciones asociadas.;puntos_de_transporte_aereo_GB035,areas_de_transporte_aereo_GB035;helipuerto_puntos_visor,helipuerto_area_visor;
aeropuerto;SINGLE;Aeropuerto;transporte;4326;Estación terrestre provista de un conjunto de pistas, instalaciones y servicios destinados al tráfico regular de aeronaves. Puede tener aduana.;puntos_de_transporte_aereo_GB005,areas_de_transporte_aereo_GB005;aeropuerto_puntos_visor,aeropuerto_areas_visor;
aerodromo;SINGLE;Aeródromo;transporte;4326;Lugar de aterrizaje de aeronaves de menor porte que un aeropuerto, con o sin instalaciones de servicios y sin aduana. Incluye aeroclub.;areas_de_transporte_aereo_GB001,puntos_de_transporte_aereo_GB001;aerodromo_area_visor,aerodromo_puntos_visor;
glaciar;SINGLE;Glaciar;relieve-suelo;4326;Masa de hielo permanente y en movimiento, alimentada desde un ventisquero y que en forma de lengua ocupa un valle moviéndose cuesta abajo. También incluye glaciar de circo.;areas_de_glaciologia_BJ030,puntos_de_glaciologia_BJ030;glaciar_area_visor,glaciar_punto_visor;
planta_urbana;SINGLE;Planta Urbana;habitat-infraestructura-social;4326;Área urbana aproximada que incluye la zona contigua de amanzanamiento edificado, cuyos límites son reconocibles.;areas_de_asentamientos_y_edificios_020105,areas_de_asentamientos_y_edificios_020106;planta_urbana_visor,ejido_urbano_visor;
canal;SINGLE;Canal;hidrografia-oceanografia;4326;Excavación artificial sin flujo o con flujo controlado, construido con el objetivo de transportar agua.;lineas_de_aguas_continentales_BH020,areas_de_aguas_continentales_BH020;canal_linea_visor,canal_area_visor;
